{
  "cycle_id": "2026-08-14-cycle-1",
  "session_date": "2026-08-14",
  "scanner": {"name": "AI-DayTrader-V1", "id": "c4646257-9c99-4e35-801b-80f8b83b81ea"},
  "timestamp": "2026-08-14T10:00:05-04:00",
  "scanner_total": 1,
  "symbols_processed": ["TEST"],
  "finalists": [{
    "symbol": "TEST",
    "classification": "NEW",
    "scanner_percent_change": 0.05,
    "rvol": 1.8,
    "gap_return": 0.01,
    "intraday_return": 0.04,
    "distance_from_high": 0.002,
    "distance_from_vwap": 0.015,
    "vwap": 9.85,
    "rsi14": 66.0,
    "ema20": 9.92,
    "volume_persistence": 1.7,
    "technical_reason": "Completed base breakout on persistent volume.",
    "material_requalification": null,
    "completed_5m_bars": []
  }],
  "security_status": {"robinhood_mcp_available": true, "boundary_ok": true, "forbidden_tools_available": []},
  "account_status": {"agentic_account_count": 1, "reconciled": true, "baseline_position_count": 0, "baseline_external_order_count": 0, "baseline_external_orders_present": false, "baseline_external_orders": []},
  "tool_call_count": {"total": 11, "run_scan": 1},
  "errors": [],
  "sol_escalation": true
}
