{
  "cycle_id": "2026-08-14-cycle-1",
  "session_date": "2026-08-14",
  "scanner": {"name": "AI-DayTrader-V1", "id": "c4646257-9c99-4e35-801b-80f8b83b81ea"},
  "timestamp": "2026-08-14T09:40:05-04:00",
  "scanner_total": 0,
  "symbols_processed": [],
  "finalists": [],
  "security_status": {"robinhood_mcp_available": true, "boundary_ok": true, "forbidden_tools_available": []},
  "account_status": {"agentic_account_count": 1, "reconciled": true, "baseline_position_count": 0, "baseline_external_order_count": 0, "baseline_external_orders_present": false, "baseline_external_orders": []},
  "tool_call_count": {"total": 5, "run_scan": 1},
  "errors": [],
  "sol_escalation": false
}
